{
  "schema_version": "mutsuki.performance.report/v1",
  "suite_version": "mutsuki-core/v2",
  "workload_version": "mutsuki-core-kernel/v1",
  "report_id": "core-full-allocation-20260719T153120Z",
  "generated_at": "2026-07-19T15:31:20Z",
  "revision_lock_hash": "023d9b654deeac48797e8d9f27de42f5c6fbfc8dd820b976396d3966b6f3f543",
  "repository_revisions": {
    "MutsukiCore": {
      "revision": "d4ec2e16db4a473c5fcf3f36a88e2ade09b3f695",
      "dirty": false,
      "remote": "https://github.com/sena-nana/MutsukiCore.git"
    }
  },
  "environment_id": "c76549c42957fbf5deb7b3cd9175cec364e7ddca3ee491e6d37a64700a79efde",
  "environment": {
    "cpu_model": "AMD Ryzen 7 5800X 8-Core Processor",
    "cpu_topology": "logical=16",
    "ram_bytes": 68618801152,
    "os": "windows unavailable",
    "kernel": "unavailable",
    "architecture": "x86_64",
    "target_triple": "x86_64-pc-windows-msvc",
    "toolchains": {
      "node": "v26.5.0",
      "python": "unavailable",
      "rust": "rustc 1.97.0 (2d8144b78 2026-07-07)"
    },
    "release_profile": {
      "name": "release",
      "lto": "thin",
      "codegen_units": 1
    },
    "power_mode": "unrecorded",
    "virtualization": "unrecorded",
    "runner_configuration": {
      "runner_instance_model": "single-active-batch"
    }
  },
  "feature_set": [
    "allocation-tracking"
  ],
  "deployment": "builtin",
  "measurement_boundary": "Core runtime kernel and Host-facing component allocation instrumentation; timing is non-headline",
  "sampling": {
    "warmup_iterations": 0,
    "samples_per_process": 1,
    "process_runs": 1
  },
  "cases": [
    {
      "case_id": "core.schedule.sparse-ready",
      "measurement_mode": "allocation",
      "dimensions": {
        "axis": "scale",
        "batch_size": "32",
        "category": "scheduling",
        "iterations": "1",
        "legacy_case_id": "scheduling/scale/tasks-1000/runners-1/ready-1/batch-32/uniform_protocols",
        "protocol_distribution": "uniform_protocols",
        "ready_percent": "1",
        "runners": "1",
        "tasks": "1000",
        "units": "10"
      },
      "metrics": {
        "allocations": 23.8,
        "allocated_bytes": 1921.2,
        "retained_rss_bytes": 1440.0
      },
      "correctness": {
        "passed": true,
        "counters": {
          "claimed": 10,
          "eligible": 10,
          "expected_claimed": 10,
          "queued_observations": 10,
          "retained_records": 1000
        }
      }
    },
    {
      "case_id": "core.schedule.sparse-ready",
      "measurement_mode": "allocation",
      "dimensions": {
        "axis": "scale",
        "batch_size": "32",
        "category": "scheduling",
        "iterations": "1",
        "legacy_case_id": "scheduling/scale/tasks-1000/runners-16/ready-1/batch-32/uniform_protocols",
        "protocol_distribution": "uniform_protocols",
        "ready_percent": "1",
        "runners": "16",
        "tasks": "1000",
        "units": "16"
      },
      "metrics": {
        "allocations": 26.4375,
        "allocated_bytes": 3181.375,
        "retained_rss_bytes": 13558.0
      },
      "correctness": {
        "passed": true,
        "counters": {
          "claimed": 10,
          "eligible": 10,
          "expected_claimed": 10,
          "queued_observations": 10,
          "retained_records": 1000
        }
      }
    },
    {
      "case_id": "core.schedule.sparse-ready",
      "measurement_mode": "allocation",
      "dimensions": {
        "axis": "scale",
        "batch_size": "32",
        "category": "scheduling",
        "iterations": "1",
        "legacy_case_id": "scheduling/scale/tasks-1000/runners-128/ready-1/batch-32/uniform_protocols",
        "protocol_distribution": "uniform_protocols",
        "ready_percent": "1",
        "runners": "128",
        "tasks": "1000",
        "units": "128"
      },
      "metrics": {
        "allocations": 11.203125,
        "allocated_bytes": 2003.015625,
        "retained_rss_bytes": 70706.0
      },
      "correctness": {
        "passed": true,
        "counters": {
          "claimed": 10,
          "eligible": 10,
          "expected_claimed": 10,
          "queued_observations": 10,
          "retained_records": 1000
        }
      }
    },
    {
      "case_id": "core.schedule.sparse-ready",
      "measurement_mode": "allocation",
      "dimensions": {
        "axis": "scale",
        "batch_size": "32",
        "category": "scheduling",
        "iterations": "1",
        "legacy_case_id": "scheduling/scale/tasks-10000/runners-1/ready-1/batch-32/uniform_protocols",
        "protocol_distribution": "uniform_protocols",
        "ready_percent": "1",
        "runners": "1",
        "tasks": "10000",
        "units": "32"
      },
      "metrics": {
        "allocations": 22.8125,
        "allocated_bytes": 1788.75,
        "retained_rss_bytes": 4660.0
      },
      "correctness": {
        "passed": true,
        "counters": {
          "claimed": 32,
          "eligible": 100,
          "expected_claimed": 32,
          "queued_observations": 100,
          "retained_records": 10000
        }
      }
    },
    {
      "case_id": "core.schedule.sparse-ready",
      "measurement_mode": "allocation",
      "dimensions": {
        "axis": "scale",
        "batch_size": "32",
        "category": "scheduling",
        "iterations": "1",
        "legacy_case_id": "scheduling/scale/tasks-10000/runners-16/ready-1/batch-32/uniform_protocols",
        "protocol_distribution": "uniform_protocols",
        "ready_percent": "1",
        "runners": "16",
        "tasks": "10000",
        "units": "100"
      },
      "metrics": {
        "allocations": 24.5,
        "allocated_bytes": 2057.3,
        "retained_rss_bytes": 22220.0
      },
      "correctness": {
        "passed": true,
        "counters": {
          "claimed": 100,
          "eligible": 100,
          "expected_claimed": 100,
          "queued_observations": 100,
          "retained_records": 10000
        }
      }
    },
    {
      "case_id": "core.schedule.sparse-ready",
      "measurement_mode": "allocation",
      "dimensions": {
        "axis": "scale",
        "batch_size": "32",
        "category": "scheduling",
        "iterations": "1",
        "legacy_case_id": "scheduling/scale/tasks-10000/runners-128/ready-1/batch-32/uniform_protocols",
        "protocol_distribution": "uniform_protocols",
        "ready_percent": "1",
        "runners": "128",
        "tasks": "10000",
        "units": "128"
      },
      "metrics": {
        "allocations": 30.328125,
        "allocated_bytes": 3568.421875,
        "retained_rss_bytes": 117492.0
      },
      "correctness": {
        "passed": true,
        "counters": {
          "claimed": 100,
          "eligible": 100,
          "expected_claimed": 100,
          "queued_observations": 100,
          "retained_records": 10000
        }
      }
    },
    {
      "case_id": "core.schedule.sparse-ready",
      "measurement_mode": "allocation",
      "dimensions": {
        "axis": "scale",
        "batch_size": "32",
        "category": "scheduling",
        "iterations": "1",
        "legacy_case_id": "scheduling/scale/tasks-100000/runners-1/ready-1/batch-32/uniform_protocols",
        "protocol_distribution": "uniform_protocols",
        "ready_percent": "1",
        "runners": "1",
        "tasks": "100000",
        "units": "32"
      },
      "metrics": {
        "allocations": 22.8125,
        "allocated_bytes": 1788.75,
        "retained_rss_bytes": 4660.0
      },
      "correctness": {
        "passed": true,
        "counters": {
          "claimed": 32,
          "eligible": 1000,
          "expected_claimed": 32,
          "queued_observations": 1000,
          "retained_records": 100000
        }
      }
    },
    {
      "case_id": "core.schedule.sparse-ready",
      "measurement_mode": "allocation",
      "dimensions": {
        "axis": "scale",
        "batch_size": "32",
        "category": "scheduling",
        "iterations": "1",
        "legacy_case_id": "scheduling/scale/tasks-100000/runners-16/ready-1/batch-32/uniform_protocols",
        "protocol_distribution": "uniform_protocols",
        "ready_percent": "1",
        "runners": "16",
        "tasks": "100000",
        "units": "512"
      },
      "metrics": {
        "allocations": 22.73828125,
        "allocated_bytes": 1788.41015625,
        "retained_rss_bytes": 62708.0
      },
      "correctness": {
        "passed": true,
        "counters": {
          "claimed": 512,
          "eligible": 1000,
          "expected_claimed": 512,
          "queued_observations": 1000,
          "retained_records": 100000
        }
      }
    },
    {
      "case_id": "core.schedule.sparse-ready",
      "measurement_mode": "allocation",
      "dimensions": {
        "axis": "scale",
        "batch_size": "32",
        "category": "scheduling",
        "iterations": "1",
        "legacy_case_id": "scheduling/scale/tasks-100000/runners-128/ready-1/batch-32/uniform_protocols",
        "protocol_distribution": "uniform_protocols",
        "ready_percent": "1",
        "runners": "128",
        "tasks": "100000",
        "units": "1000"
      },
      "metrics": {
        "allocations": 23.961,
        "allocated_bytes": 1995.014,
        "retained_rss_bytes": 209412.0
      },
      "correctness": {
        "passed": true,
        "counters": {
          "claimed": 1000,
          "eligible": 1000,
          "expected_claimed": 1000,
          "queued_observations": 1000,
          "retained_records": 100000
        }
      }
    },
    {
      "case_id": "core.schedule.sparse-ready",
      "measurement_mode": "allocation",
      "dimensions": {
        "axis": "ready_ratio",
        "batch_size": "32",
        "category": "scheduling",
        "iterations": "1",
        "legacy_case_id": "scheduling/ready_ratio/tasks-100000/runners-16/ready-0/batch-32/uniform_protocols",